;context;emotion
11699;i loved my supervisions because i come in feeling like a dumb dumb and leave feeling so heroic as if ive accomplished something huge;sadness
11703;i didn t feel like i was being punished and didn t feel any pain at any time;sadness
11706;i cant help but feel how much burdened my parents are;sadness
11707;i swear it felt like every single feeling of exhaustion i have had and then ignored in the last months came flooding back to me last night;sadness
11713;i was told it would make my arms go numb but i didnt feel anything numb about it as they pricked my arm with their so called baby iv;sadness
11718;i asked him how it felt to be under a flogger wielded by me he said it made him feel more submissive to me that he was more and more mine at least for the night;sadness
11726;i deprive myself of everything nice i end up cracking feeling terrible for eating something bad and in turn eat more of it;sadness
11727;i could compare john fullbright to a lot of people to try to give you some reference points but i feel like that does him a disservice as soon as you think oh hes like fill in the blank suddenly hes not;sadness
11731;i thank him when i feel so utterly defeated;sadness
11736;i feel rejected like i dont belong to the circle those circles that i realised i never was comfortable there;sadness
11738;i begin feeling remorseful for not being more selfless and spreading the gospel;sadness
11746;i feel a bit dumb;sadness
11747;ive moved to northern saskatchewan i feel truly victimized;sadness
11749;i feel so unimportant to all of them they all have more special friends partners etc in their lives;sadness
11750;im happy to have finished the script s its good to have a feeling of accomplishment but im feeling rather discontent;sadness
11754;i lay in bed on tuesday night feeling terrible;sadness
11760;i kept quiet feeling a little foolish that i had been too quick to jump into conclusion;sadness
11770;i love the idea of the white blouse under the jumper because i feel the jumper would be too boring without a collar and with the pink spiked necklace underneath the collar i think this would give the jumper a nice touch;sadness
11775;i just feel so dirty;sadness
11777;i must say i do feel troubled a href http emillionstars;sadness
11779;i feel the only news which soothes the troubled minds is the news from uk;sadness
11780;i feel so sorry for you your family and friends;sadness
11781;i just feel so listless and lost;sadness
11788;i really feel deprived;sadness
11791;i feel when i have to sit alone;sadness
11796;i feel totally disillusioned with med school with london but most especially with my uni;sadness
11801;im feeling a little melancholy tonight days ago;sadness
11805;i came down into the kitchen of my childhood still in a dream i was like a mini baby on the kitchen table and i told my mother that she should expect to get this kind of a damaged child because she was so narrow and unwilling to feelings and emotional support;sadness
11807;i feel vain when reporting everyday happenings in my life;sadness
11808;i put these to one side and focus on the following version of the shameful revelations allegation even in an ideal egalitarian society having to reveal to the state that one is untalented would cause citizens to feel ashamed;sadness
11813;i feel like weve been doomed from the start and yet were still together two years later;sadness
11815;i can feel my stomach aching and grumbling;sadness
11817;i feel the compulsion to get low;sadness
11818;i know how u feel i hated how people say to just stop thinking about it but try to get help and distract yourself also try to get ur anxiety out in a healthy or helpful way;sadness
11819;i feel discouraged and beaten down i do better when i can pray about it obviously and then call my mama and friends;sadness
11822;i had been chained up well time was hard to gauge i had been flogged pierced cut blind folded had hot wax put onto me and deprived of light and sound for periods but never did i feel abused;sadness
11827;i cry at the feeling of the suffering of mankind as i have to let go and let the pain flow;sadness
11829;i discovered this song called bring me flowers by hope and as beautiful as it is i cant help to feel melancholy whenever i listen to it;sadness
11832;im feeling so devastated by losing something that others may see as trivial my god takes on that weight as if it was his own;sadness
11833;i feel humiliated to introduce you to my colleagues as my wife;sadness
11840;i feel like i was abused raped defiled;sadness
11841;i feel so remorseful for doing this to him;sadness
11844;i started feeling a bit homesick with the mention of mulligans name;sadness
11846;i am feeling rather vain today because my hair looks good and so i have decided to do an entire post about beauty products;sadness
11850;im not mistaken all the thai business leaders at the dinner feel ashamed about the setbacks that have held thailand back from its full potential;sadness
11855;when i couldnt find my dog which was missing;sadness
11857;i feel somehow regretful;sadness
11860;im just feeling sort of lame and lonely;sadness
11876;i feel helpless and lacking right at this moment all i want to do is go to edmonton and then wainwright and look after david;sadness
11877;i suspect this is a big reason why so many on screen interactions feel so fake;sadness
11878;i feel the weight of emotional issues much more now;sadness
11881;i feel that they will hire billy over sasha because they will not have to pay billy to play catch up on the work that he missed;sadness
11884;i have noticed my body has not been to happy when i eat red meat and last week i was feeling lethargic and a little seedy nothing i put in seem;sadness
11885;i feel the sting of the words as a dull ache and heavy tear ducts not for my miserable highschool life or for having always been the target;sadness
11886;i feel like ive been to submissive and let too many people just walk over me;sadness
11887;i feel horrible and i would prefer to extend my deepest sorrow rel bookmark permanenter link zum eintrag;sadness
11890;i feel more like damaged goods than ever because i burned out prematurely;sadness
11895;i feel this perverse pleasure in knowing how were so much the opposite of everything youre supposed to do;sadness
11896;im inclined to think his feeling disturbed is at least partly due to the manifest problems with the tactic;sadness
11897;i was feeling groggy and just wanted to sleep but he asked me what kind of surgery i had and a multiplication question;sadness
11898;i am feeling stressed and more than a bit anxious;sadness
11902;i start to feel less exhausted the bits and pieces of life start to seem far more surmountable;sadness
11904;im not a huge fan but one of my best friends in high school loved her and so many of brittneys songs remind me of a time i actually had friends so i listen to not feel so alone;sadness
11905;i didn t feel an aching inside;sadness
11908;i wasnt going to make this about what i cant eat and feel like i was suffering or giving anything up i was going to make this about what i was going to gain and what i could eat;sadness
11909;i am so tired of feeling sorry for myself;sadness
11910;i was going through a painful breakup and went looking for anything that would make me feel less anguished;sadness
11913;i liked boys and didnt feel inhibited by them;sadness
11935;im already feeling stressed without trying to sort that lot out;sadness
11941;i feel a bit foolish now;sadness
11942;im not trying to sound so depressed or sad or heartbroken but feeling all shitty once in a while is just human;sadness
11944;i did something to my back after moving my piano this week im not hercules just terribly stupid so i was feeling a bit miserable for myself this morning and then this turned up in the post;sadness
11945;i feel really dumb but also have way more sympathy for people with real and life long allergies;sadness
11947;i feel stupid img width height src http voicesfromkrypton;sadness
11948;i do feel that you are a little needy because of the tone in your note to me;sadness
11950;i was feeling so stressed up whenever he doesnt sleeps because i am out with my friends;sadness
11955;i feel very regretful for what i might done i dont think i remember it;sadness
11956;i feel lethargic and unmotivated in the mornings to wake up and blog or catch up on other things that i could do in the mornings so i can have my evenings free;sadness
11959;i am tired of feeling sorry for myself so i decided to just be thankful and praise the lord as we rode;sadness
11963;i began to feel unimportant useless insecure and i was disconnected from everything that i used to know;sadness
11964;im feeling all puppy dogs and rainbows when im exhausted yes believe it or not my hour work week can be exhausting too have work piling up and havent been able to do laundry or grocery shop in a week cause i have other things to do;sadness
11966;my grandfather died he lived almost as a recluse not caring for himself as well as he should dad and we all helped as much as we could;sadness
11968;i feel so low from living high chorus post chorus outro i need you more need you more i need you more than dope;sadness
11969;i make this blog post i am feeling the melancholy running through my veins;sadness
11971;i went to an lds step meeting and was so overwhelmed by evil feelings and just broke down and said so at the meeting and expressed how low i felt and how ready i was for these feelings to leave my body;sadness
11973;i feel awkward and so i start acting awkward lol;sadness
11974;i go back to my village i feel i am really lonely;sadness
11981;i am afraid that i will feel very regretful at that time;sadness
11985;i dnt want yu guys t feel shamed fr knwing nthing instead f pretending r having plastikan with me;sadness
11987;i must say that this makeover has been all consuming coupled with some major changes at work coworkers having babies and i feel like i have been a neglectful lady;sadness
11990;i concentrate on anything else when he feels so miserable;sadness
11991;i truly feel sorry for them;sadness
12002;i am feeling generally morose and didnt stop for my jamba juice today so i am going for a frappucino later;sadness
12006;i have a feeling it is soon going to become a rather messy heavy book which no one will want to look at but i reckon it will mean the world to me;sadness
12012;i marvel at the wonders of life this happened a while ago but i am feeling sentimental this week;sadness
12015;i know i will feel quite melancholy this weekend as its our very last bit of relaxation downtime within those four walls before a week of working packing and then eventually moving;sadness
12019;i was out until at a social gathering so i feel a bit groggy today;sadness
12025;i was pregnant with emily and therefore always feeling exhausted it wasn t that hard to sleep when walter slept if i needed the extra rest;sadness
12026;i have a headache and feel weepy;sadness
12027;i used to feel sorry for some people who felt the need to pretend;sadness
12030;i had to have something to give the katy and the danny and of course they stalk my blog and of course i couldnt leave erica feeling unloved;sadness
12031;i feel a bit less burdened with things hanging over my head;sadness
12035;i am ruining her feeling and was disturbed a href http membres;sadness
12036;i just feel totally devastated;sadness
12040;i feel lame saying mommy just needs to pay this bill call a guy about the camper and paint bedrooms to be more neutral;sadness
12043;i feel also just drained;sadness
12044;i am sorry to hear that the assessment procedure conducted by atoshealthcare left you feeling humiliated and poorly represented;sadness
12045;i just hate the feeling of being unhappy;sadness
12046;ill just paraphrase i ranted about not being able to trust anybody and being hurt feeling rejected etc;sadness
12048;i really hope so i feel so isolated right now and on top of feeling overwhelmed confused lonely stressed and nervous it s really difficult at the moment;sadness
12069;when i heard the news of the death of my father it was in the evening and i was alone all night in my room trying to remember the face of my father;sadness
12074;i feel punished by my parents;sadness
12075;i made a shocking discovery that made me feel incredibly dumb and to which i of course feel the need to share;sadness
12079;i feel so dumb witted because i feel like i dont understand his answers towards me;sadness
12081;i was feeling extremely shitty physically this morning;sadness
12085;i feel even more disturbed by that than what happened prior to me going to sleep;sadness
12088;i have feeling this is fake;sadness
12094;i lie in bed or is it a coffin it feels more like a coffin not altogether unpleasant just very still i push my legs together and cross my hands i try not to cry i sink downwards hoping for a prick a poke a tube of fluid a needle of;sadness
12098;i now feel that food is to be enjoyed and not abused;sadness
12111;i also know on certain days when im feeling crappy its only because i didnt bring enough cigarettes;sadness
12112;i was so scared of feeling stupid or unintelligent or why i felt like i wasnt smart enough;sadness
12113;im starting to feel that im suffering from fatigue;sadness
12118;i hang my head down and feel even more embarrassed to complaint about such minor things in my life when others are having a hard time just surviving minute to minute of the day;sadness
12119;i said those who feel unhappy with the way uhuru has been running his government should wait for the elections;sadness
12131;i feel so unimportant to you now its not even fucking funny;sadness
12133;i was feeling stressed we were all like coiled springs and it wasnt going to end well;sadness
12135;i feel like a whore and im ashamed of;sadness
12137;i have this kind of life so my girlfriend would feel very lonely for sure;sadness
12138;i have been in the advertising world for over years and left nyc years ago after working as a creative director at some of the best agencies in the world feeling discouraged demoralized and questioning everything that i thought i love in the world of creativity;sadness
12142;i grabbed my shoes no socks too lazy and got on the car and the teacher greeted omg she is so nice i feel really bad;sadness
12145;i must not be left to feel foolish lost unhappy and with distaste;sadness
12146;i went back to it because i was feeling so intensely crappy;sadness
12152;i feel ugly i look ugly;sadness
12156;i feel empty and dim if i miss that;sadness
12160;i watch this clip every time i feel a bit miserable and need a laugh;sadness
12161;i am feeling emotionally and physically exhausted;sadness
12169;i feel like ive been defeated;sadness
12170;i am feeling mega pathetic and clingy todayyy;sadness
12173;i cant describe how im feeling without giving it away but in a way im feeling a bit heartbroken but definitely touched;sadness
12176;i couldn t see a future without the pain and i was feeling heartbroken i d gone from being a very happy and active mum doing lots of outdoor activities with my children;sadness
12178;i feel a little less burdened;sadness
12187;i remember amsterdam where the circumstances were difficult and i was feeling melancholy;sadness
12188;hearing about developments of sience in the west a lot better than china;sadness
12193;i feel even more beaten down without the encouragement and am afraid i might try to hide from the world in bed feeling like i ve already lost;sadness
12195;i don t know how to feel any other way about losing someone who feels like a member of my family than heartbroken;sadness
12196;im not sure if it has something to do with venus being so close but i have been feeling so depressed;sadness
12197;i don t feel too troubled over work anymore getting used to the movement of the day;sadness
12208;i feel remorseful when i act the drunken fool too;sadness
12218;i feel the isolation and despair of the rejected;sadness
12219;i feel dirty srcurl http draftbloger;sadness
12221;i was feeling aching earlier this morning but not much now;sadness
12226;i did feel bad for her because she did feel like she was getting pressured to get her cherry popped;sadness
12228;i would feel miserable but i believe this misery comes from me not placing my faith in the works of christ;sadness
12240;i have had things happen and allowed things to happen to me that have made me feel ugly disgusting and unworthy of being loved or even feeling like i matter in this world;sadness
12242;i know this is supposed to come across as funny but i can t help but feel sorry for the poor guy;sadness
12243;i dont really care about just because i can and thats what feels rotten;sadness
12246;i feel listless and unable to imagine ever working again;sadness
12247;i feel permanently heartbroken but at the same time if she were to ask me out again i would mend it right up and do it again;sadness
12248;i started feeling like myself again but it was a pretty rotten time in between;sadness
12255;i did indeed feel sentimental about this first home of ours together;sadness
12256;i love loving people and when i get the opportunity to really show how i feel i m going to do it no matter how stupid it sounds;sadness
12257;ive spent a while with i still cant make good conversation with and feel awkward around;sadness
12268;i have realized from this past week is that it is ok to feel heartbroken;sadness
12270;i think i could manage one team in jacksonville without feeling too dirty;sadness
12271;i feel defective for not wanting what makes me a woman;sadness
12273;i actually feel really horribly vain posting this but im kinda curious;sadness
12277;i feel really stressed out;sadness
12280;i feel stupid typing that;sadness
12282;i feel like one of those dirty confidential intermediaries that i so dislike;sadness
12285;i think i used to overeat i mean one reason anyway was because i wanted to make sure i didn t feel deprived later;sadness
12287;i just want to stop feeling so shitty i feel terrible and horrid and eurgh;sadness
12303;i just feel disillusioned;sadness
12307;i don t know but i enjoy watching movies where pain transcends on me like i can feel my heart aching or i can cry a pail of tears;sadness
12309;i would not accept his love fully feeling of being damaged;sadness
12310;i say i wish shed found out the whole score its more because i feel sad at the idea of her finishing up different from me and tommy;sadness
12319;i have to loathe myself or even allow myself to feel damaged long term;sadness
12322;i feel like ive missed the boat;sadness
12325;i will feel somehow punished so she holds me as much as possible when she puts the baby down;sadness
12326;im feeling too stressed doing homework that i dont feel like going out;sadness
12328;i reconciled and life goes on as does marriage but i feel terrible for what i did to her and to the one with whom i had the affair;sadness
12330;i long for this its a need i feel is all of this in vain;sadness
12339;i started this off feeling a little melancholy but i think the holy spirit must have come in and given me a hand because i feel like now i understand my situation better than i did half an hour ago;sadness
12346;i was feeling unhappy with my work i joined in with the carping;sadness
12347;i cant feel the pain but i feel the aching ness of my cheek dont know if its because of the long period of opening my mouth;sadness
12352;i used to want to get married so i feel a little heartbroken;sadness
12357;i feel so emotional when i saw those touch flusher but the position is still on the back when youre in seated position;sadness
12358;i had been feeling rather unhappy lately because id been feeling left out of groups friends;sadness
12360;i feel like im really settling into my life here and like im finally back in the spain that ive missed for more than years;sadness
12361;im going through some feels today and ive got to admit theyre pretty unpleasant;sadness
12362;i just feel so ugly;sadness
12364;i have a feeling i was one of that idiotic childish trumpeters he was talking about luh;sadness
12365;i also think its because im so afraid of feeling victimized again;sadness
12366;i feel for pete but i also admire the fact that he is not devastated by it and is still his positive happy self;sadness
12373;i was feeling quite broke;sadness
12375;i feel im being punished for not being able to do my dailies;sadness
12378;i was feeling pretty gloomy when i started writing this it s that dreaded time of year of course i burnt the nd set of cake pops that i was baking and i just lost a game of monopoly that game sucks;sadness
12381;id like to think i could live happily away from home but i know id definitely feel homesick id miss my friends and our fun outings the most;sadness
12389;i feel completely groggy this morning;sadness
12390;i feel grief for the families of those who were caught in this tragic incident;sadness
12393;i wont feel so damn idiotic;sadness
12395;i am here to update my blog just found out that my blog looks feels dull when there are no updates;sadness
12400;i just got home from a dinner with the barcial it was fun but it made feel so gloomy;sadness
12402;im feeling quite pathetic and miserable actually;sadness
12404;i understand and appreciate the concern for safety i feel that the real focus of the market the vendors has been ignored;sadness
12407;i am feeling really quite disheartened;sadness
12410;i am living with my dad and his wife in his new home and i feel very unwelcome here;sadness
12416;i feel ungrateful by saying this because the school is still letting me go to prom;sadness
12420;i have to admit ive been feeling kinda homesick these past couple of days;sadness
12421;i felt like earlier this year i was starting to feel emotional that it was all over but now its just surreal confusion to be quite honest;sadness
12422;i feeling humiliated;sadness
12424;i could feel her eyes boring a hole in my neck as i quickly stepped to the side so i wasn t in the way of her son anymore;sadness
12425;i still feel a little shitty right now as i type this;sadness
12429;i was feeling pretty rotten;sadness
12432;i can barely stand the sight of a dog wearing a choke collar because i feel the dog s suffering;sadness
12437;i will stop feeling heartbroken when i see my unfollows;sadness
12439;i don t like feeling that my family damaged me in some way even though they didn t mean it;sadness
12443;ill feel terrible in the end i dont know why i chose to continue being the shoulder for people to cry on or the one reliable person they can always turn to;sadness
12444;im gonna make you feel just as worthless as you did a few years ago im going to make sure you remember how bad people spoke to you or treated you especially when you needed them;sadness
12447;i say to someone that i feel i have humiliated yeah well thats what you get;sadness
12448;i realised that this was no longer the truth it was merely the truth i remembered i began to feel disheartened;sadness
12449;i left the office feeling discouraged;sadness
12454;ive been feeling depressed anxious and unhappy;sadness
12456;i and most women don t feel particularly burdened by taking the pill there is some unfairness to it;sadness
12460;i feel deeply disturbed that another mother would condemn me and other mothers like me for finding fulfillment in being a mother;sadness
12462;i feel like a totally horrible person but i really wish he was coming another weekend;sadness
12468;i feel groggy this morning;sadness
12469;i feel somewhat hopeless and pitiful;sadness
12472;im feeling rather disheartened;sadness
12473;i feel so helpless i have no one to talk to;sadness
12477;i suppose that is enough of a statement for those who might feel as i do about his contribution to the unfortunate attitude and rhetoric of conservative christian america;sadness
12484;i feel like it s boring;sadness
12487;i hated feeling inadequate to meet their needs;sadness
12488;ive struggled with feeling inadequate or subpar in various areas of my life and i know i always will;sadness
12492;im feeling plunge us into a world of melancholy and love;sadness
12493;i feel alone and abandoned i believe i am alone and abandoned;sadness
12494;i feel like im waiting for her to get heartbroken all over again;sadness
12503;i have hated feeling useless and ineffective;sadness
12504;i have to admit i have been feeling very disheartened and disillusioned with the whole publishing community for months;sadness
12509;i am gonna feel lousy i might as well feel lousy while i am doing something;sadness
12527;i were feeling pretty isolated and marginalised and my greatest enemy was the united states which is the only country to have ever deployed a nuclear weapon or two against civilians then i might just want to get one myself;sadness
12532;i feel like i am one of them now before i resigned i got offered a job at the local council;sadness
12537;i feel a mix of emotions lonely sad insecure angry;sadness
12541;i feel deprived of any intimacy at all;sadness
12542;i feel so mush freeer and less repressed;sadness
12555;i know the feeling of plans disturbed schedules disrupted;sadness
12563;i dont even think i would be ready to be fuck buddys because if theres emotions from him i would feel horrible when im not giving them back;sadness
12565;im not a huge history buff but i do feel emotional when i think of my great uncle;sadness
12568;i saw a gain on the scale this morning which didn t surprise me but it did make me feel pretty lousy a lot of it is water weight and disgestive issues which will pass but i need to put some work in to push on now months till christmas did i hear you say;sadness
12569;i feel positively ashamed when i look out of the window and see the state of things;sadness
12570;im feeling somewhat verbally lame as i listen for the eighth time to suzanne vegas nine objects of desire;sadness
