;context;emotion
8463;i also feel like maybe you dont want the real messy authentic mark;sadness
8466;i wasnt so terribly sore i would feel a bit regretful but theres papers to write and ebony dances to practice for;sadness
8475;im sad i feel that every heartbroken song was written just for me;sadness
8478;i need to feel my ears agonized by the high treble of a guitar amp turned all the way up;sadness
8480;i feel absolutely defeated socially;sadness
8483;i feel like i am a little ungrateful but i love my home and sometimes getting away is a great way to remind you how much you love the life you have;sadness
8486;i feel doomed for wanting to get a doctorate of something besides medicine;sadness
8487;i feel as if i had an unfortunate run in with tyler durden and his fight club;sadness
8488;i always end up crying and feeling so hurt like its the end of the world;sadness
8496;i prove myself wrong here i am feeling ugly because i made no attempt to get out of my sleeping clothes oh and my eyebrows;sadness
8501;i feel terrible for him but omg;sadness
8502;i refuse to stay in this place we all have moments of feeling exhausted from very hard work and needing some validation in return;sadness
8505;i feel like there needs to be a disclaimer that i am in no way romanticising the shitty aspects of this pairing okay it is fucked up beyond belief summary castiel holds the world in the palm of his hand;sadness
8508;i got home feeling extremely sleep deprived and spent a week getting caught up on all the different post conference emails and phone calls not to mention sleep and laundry;sadness
8509;i really thought that after we had her i would stop feeling pained when i heard about other people getting pregnant;sadness
8518;i still cant make it for longer than a half hour in the office before feeling awful and having someone drive me home but i feel perfectly fine when im sitting on my butt on the couch all day;sadness
8519;i feel beaten and bruised from their harshness and wearied by their relentlessness;sadness
8521;im feeling really lethargic and weird today;sadness
8527;i really do feel unfortunate for the person who has to carrry me;sadness
8528;i do feel a bit guilty about the mean things ive said about jahmene as i heard his brother committed suicide so i think that abuse by their dad must have been pretty hardcore;sadness
8534;i can pick at my skin for a while and make myself feel terrible and then when i feel bad enough that i need to make myself feel better i can stop and theres the illusion of released pressure;sadness
8536;i feel ugly i mean i m being calle;sadness
8543;i started this blog is because i was desperately lonely and i wanted someone to know how i was feeling all of the ugly thoughts and emotions;sadness
8545;i always feel like im entirely pathetic and needy but those people usually tell me that i was neither just quieter than usual;sadness
8547;i wake up feeling all beaten up and i dont feel that way right now im probably going to be tempted to do the lake again;sadness
8551;i do feel devastated;sadness
8556;i have noticed more symptoms coming back over sleeping and eating feeling lethargic my temper and doing less around the house;sadness
8559;i love more than anyone made me feel like i hated them sooo much but i knew i didnt which really hurt i ened up being a dick and crying for like an hour in front of people which was even more stupid;sadness
8566;i am a year later heavier than ive ever been i gained back that lbs in the weeks i was pregnant trying to sort out feelings for my troubled marriage missing my hearts dream of dance wondering if ill ever want more kids again and if that makes me a horrible person;sadness
8569;i am feeling so weepy and emotional still;sadness
8570;i feel like this is a dirty confession;sadness
8574;i have learned to not take myself seriously enough to feel humiliated;sadness
8575;i also began to feel my contractions at a very dull intensity;sadness
8581;i type this i feel like one of those unfortunate animals that gets caught in washing machines and somehow survives much lighter ragged and half dead;sadness
8584;i was feeling very melancholy tonight for reasons i dont want to talk about;sadness
8587;i speak of friends online who drop me from friends lists i feel unloved and disregarded;sadness
8589;i needed with money that i had occasionally made me feel guilty;sadness
8592;i feel so dull and drowsy all the time;sadness
8593;i feel almost embarrassed to be writing its been so long since i have;sadness
8596;i am feeling disappointed at myself for making mistakes or getting frustrated for not knowing a lot of things taryns words would be ringing in my head;sadness
8598;i found it to be a deeply moving read and i feel it s a book that should be read twice because there s so much in there you ll discover the second time around which you might ve missed on the first read;sadness
8599;ive lived too long feeling shitty being picked on and feeling like the odd one out;sadness
8601;i feel a little pained but that will probably pass the last illusions of childhood;sadness
8603;i feel like were kind of boring;sadness
8606;i feel empty inside iphone wallpaper mobile wallpaper to your wap folder img src http images;sadness
8609;i know beyond a shadow of a doubt that i am loved i feel the most unloved unworthy and rejected ive ever felt;sadness
8610;i could curse swear be angry be sad be happy be moody etc etc on the things i write just because i feel kinda disturbed with the search queries displayed on the dashboard that containing my name full name blog s name or my usual nickname;sadness
8612;i am feeling listless without direction;sadness
8623;i feel like youre ashamed to be seen with me in public because im bigger than you;sadness
8630;i feel lousy on a daily basis;sadness
8631;i feel dirty even admitting that ive seen it much less own it on dvd;sadness
8633;i feel for steve irwins family but it was a tragic accident;sadness
8635;i couldnt help but feel that all these people had missed the best of the day;sadness
8644;i feel like i have doomed myself to failure;sadness
8646;i fell for it big time and feel appropriately shamed;sadness
8648;i just cannot write when i am so sick and that means more than a week of feeling rotten which means a stalled novel;sadness
8649;i didnt feel any emotional pulls toward anyone except the lord;sadness
8652;i heap the guilt on and feel worthless and embarrassed because of my lack of productivity;sadness
8653;i entered a depression feeling helpless hopeless and adrift betrayed disillusioned and wondering who i could trust;sadness
8656;im sleeping better i still just generally feel exhausted i so hope this feeling passes soon;sadness
8662;i feel dirty and don t know why;sadness
8664;im feeling a bit melancholy for some reason so im not going to post further for now but hopefully this re discovery of my old thoughts and goals will help me to re align my focus a bit;sadness
8667;i feel a little sentimental about because i distinctly remember as a child celebrating my parents th birthdays and they seemed so;sadness
8668;i feel even if he killed himself it was because he was agonized to that extent;sadness
8669;im going at it with so much gusto i feel aching in my body already;sadness
8670;i was happy with the progress but i was also beginning to feel a little hopeless;sadness
8671;i can feel it physically sort of aching and now im kind of expecting a response i dont know what it would say but ive got a good idea;sadness
8673;i remember feeling so helpless i had been a mother for no less than hours and i had already failed my daughter;sadness
8677;i feel like i missed my calling id be a damn good special ed teacher;sadness
8689;ive been thinking about it because recently theres been times ive been overwhelmed with gratitude to the point of tears and other times im thinking about it because im im feeling so incredibly ungrateful maybe also to the point of tears and wondering why;sadness
8700;im in a strange situation or feeling awkward i sometimes switch into comedian mode a bit of a defence mechanism from my self conscious school days and turned some of the sessions into katrinas minute stand up routine;sadness
8702;i was worried that it would be awkward and i would feel lonely;sadness
8710;i feel so disturbed i have been having difficulties sleeping;sadness
8711;i should feel all weepy;sadness
8714;ive eaten today well ill give you the highlights i feel like focusing on the negatives like that unpleasant green curry from thai club;sadness
8715;im heartbroken about in love with the world but i think maybe im feeling heartbroken so acutely is it came to me today that every time ive been asked to stay somewhere in the past years or so ive left;sadness
8717;i feel like if i m too fake with lighting you ll be taken away and not immersed in the story;sadness
8721;im feeling discontent with my sex life i feel like crying like venting about it;sadness
8723;i didnt feel if i was having a shitty day i wouldnt usually come right out and say i was having a shitty day;sadness
8726;i feel empty and lonely i want to cry but i cant i want to scream and im afraid to;sadness
8732;im feeling fairly miserable about this;sadness
8733;i feel low or exhausted i either watch this movie or listen to this poetry;sadness
8734;i was so scared it wasnt even funny it just made me feel more pathetic and stupid;sadness
8735;im ready to start my shots again that two and a half weeks off just flies and im feeling miserable about it the thought that these peeps will be helping me through it makes it a bearable experience to the point where when this whole thing is done and dusted i will actually miss them all;sadness
8738;i feel embarrassed looking at wedding dresses;sadness
8740;i consistently ask myself especially when i am feeling low or having doubts about my future;sadness
8741;im reading through the online world of blogs i start feeling pretty dumb;sadness
8746;i cant be bothered as coming and doing is a pleasant pass time followed by cascades of positive feelings unless you are sexualy troubled;sadness
8747;im beginning to feel listless and a bit lonely;sadness
8748;i hate falling asleep napping during the day i wake up feeling so groggy;sadness
8755;i have to visit them every after school and later i have to go tuition and i do not have the time to even study for my exam next week and i have a feeling that i am so going to fail a lot of my subjects and to be blamed for either not concentrating during class or not studying;sadness
8756;ive made it through a week i just feel beaten down;sadness
8758;i feel i begin to compare myself to others what an ugly and painful thing to do;sadness
8760;i was left feeling embarrassed stupid but i was on a mission to fuel up with coffee is this an excuse;sadness
8762;im feeling today youd think that the men had beaten me up;sadness
8764;i feel a bit stupid for writing that but it s true;sadness
8770;i just don t feel i have it in me to get out of bed i can will the dull throbbing of hopelessness to give way and let forth a renewed sensed of hope reflect back on my accomplishments and dig up the inner strength i ve worked so very hard to reestablish;sadness
8771;i have been feeling crappy about myself for too long and its time for something to happen;sadness
8773;i don t know but it seems important to them that i feel unwelcome;sadness
8776;i feel so burdened as if something is holding me still and weighing me down;sadness
8777;i feel is awkward because it s too high four steps for a;sadness
8778;i can t wait to get it over with i m not feeling stressed but absolutely hating studying;sadness
8783;i don t feel like i have been shamed for my body but i have felt pressure to have a more socially acceptable body size;sadness
8786;i know takes a lot of present moment awareness and part will be the challenge of accepting things as they are so i don t set up a feeling of wanting or discontent;sadness
8792;i feel a bit gloomy in general and not entirely sure why;sadness
8799;im around my husband or home alone thinking about him that i feel hopeless;sadness
8801;i feel i cant stop aching;sadness
8802;i really feel like everything is so worthless;sadness
8806;ill have to admit while it was an awesome feeling many a time i didnt know what to say froze or went mind blank while observing her;sadness
8807;i step back in the game day after day even when the odds of success seem out of favor i love on and when i feel nothing but ugly inside she is there to remind me of who i really am and nothing could be prettier than that;sadness
8808;i should run i should always run but i controlled myself pretty well at dinner and did not even feel guilty;sadness
8809;i don t mean to be rude but i don t feel i want to be troubled with the thoughts right now;sadness
8810;i want to learn something new when i m feeling dull;sadness
8813;i woke up early and felt strangely alert and good in contrast to my usual mornings feeling groggy cranky and sore;sadness
8815;i just feeling needy;sadness
8818;ive been holding onto that are making me feel rotten;sadness
8827;i feel idiotic and wierd in this class;sadness
8830;i now feel almost resigned to the loss of the hopes and dreams i once had;sadness
8831;i feel rejected by all the men i like i gave up on asking why and what i did so they ran away;sadness
8833;i feel awful but i just don t know how to get a child to write letters draw certain things or make up words with the paper letters i had to back onto card laminate and cut without totally losing my shit;sadness
8841;i woke up feeling this aching in my heart;sadness
8843;i do not want her to feel ugly;sadness
8844;i feel low low low just feel like i dont fail because i cant i fail because its my fault whether actually im able to do it but i just sigh its major fail fail fail;sadness
8846;i feel so weepy like any moment i could just burst into tears;sadness
8850;i feel kind of dumb;sadness
8851;i have been talking with a growing number of friends over the past few months who have been telling me stories of feeling emotionally beaten up by life;sadness
8852;i cant help but feel so helpless;sadness
8855;i usually have a solution to these kinds of situations but right now i just feel unhappy and run down;sadness
8857;i started to open up about it i started to feel more like myself the stephanie who isn t embarrassed by life s setbacks who tackles difficult situations with humor and honesty;sadness
8858;i just had a baby i feel crappy about myself and my husband doesn t seem to want to have sex with me as often;sadness
8859;i have this sort of feeling like an emotional undercurrent that im waking up in a sort of spiritual inner heart kind of way;sadness
8860;i always feel this sadness and aching in my heart when i look at him;sadness
8863;i am a month later feeling as hurt as i did that november th when i got his email;sadness
8869;i feel as if i could speak volumes and be ignored;sadness
8871;i really enjoyed feeling that i was not alone;sadness
8877;im feeling a bit listless but after the weekend from hell it had good points also im glad for some time to wind down;sadness
8879;i feel i hated you despised you yet you can make me happy even when i was sad in a matter of minutes;sadness
8880;im completely fine with bowler providing readers who might be going through a similar identity crisis with the message that they are not alone that their urgings and longings are normal and that they shouldnt be made to feel ashamed of them;sadness
8882;im still feeling pretty gloomy if truth be told;sadness
8887;i can feel suffering and turmoil but it also feels the same;sadness
8900;i didnt let the swim leave me feeling defeated;sadness
8904;i feel bad for searching for rule;sadness
8908;i scanned the ground methodically feeling hopeless;sadness
8909;i admit to feeling a little foolish when i first arrived;sadness
8914;i glimpsed a visitor but i could feel it was disturbed somehow whether mad or confused or something similar;sadness
8922;i feel at the end of a run isn t because i broke a personal record or enjoyed the fog rising over the boardwalk during sunrise it s the sense of accomplishment knowing i beat my mind;sadness
8928;i feel shitty these few days because of work;sadness
8932;i quit my job in financial services feeling disheartened and disillusioned and i took a complete u turn in my career returning to university and studying something very different from what id been doing in my job;sadness
8935;i still feel so empty and lonely;sadness
8936;i feel that the perpetrator should be punished to the full extent of the law;sadness
8942;i usually feel regretful and guilty after the quarrel usually its me who turns the talk into a quarrel i yell loudly and throw the things beside me with mama;sadness
8943;i feel ugly to stop being lazy so i dont embarrass my friends to wear white so i could have short hair without feeling fat not that i really want short hair but still to be able to kiss someone without feeling like i have to pull away;sadness
8946;i feel all depressed;sadness
8949;i feared would happen with a amp a after last weeks ep is now playing out just as i had pictured it in a way that makes every scene with annie and auggie just make me feel miserable;sadness
8951;i feel terribly neglectful of my blog;sadness
8952;i feel slightly unimportant;sadness
8958;i didnt respond because i feel that some days i cant just put on a fake smile and pretend like life is great and not let the negativity creep in;sadness
8959;i fully understand the frustration that many fans are feeling but as a target blank href http twitter;sadness
8963;i found having old pip constantly on stage rather disruptive he sometimes reacted along with young pip and sometimes didn t he sometimes moved position in dramatic scenes and he just left me feeling rather awkward;sadness
8968;i still have the lurgy and feel rotten;sadness
8969;i get the nasty feeling that my posts are boring the pants off everyone;sadness
8970;i had some delicious apple pie so needless to say i was feeling pretty groggy;sadness
8971;im feeling pathetic i cant take rejection why wont you call me;sadness
8975;i hate feeling empty and numb;sadness
8979;i wake up real life husband i feel melancholy towards day;sadness
8983;i felt like i couldnt let myself believe the feelings i was getting from these men that the phone call had been a fake;sadness
8985;i didnt end up with that popular guy before the feeling i had when i was rejected its like a break up what i thought during that time la;sadness
8986;ive recently had one of those experiences that left me feeling inadequate;sadness
8990;i feel horrible for people whose babies accidentally suffocate from blankets and stuff because the guilt must be terrible but in a case like that it was avoidable so its more frustrating than anything;sadness
8991;i told him if i felt better i would go with him but that i was still feeling really lousy;sadness
8994;i feel sorry for those that can t eat mangoes amp grateful i can;sadness
8999;i am wondering though is if i m content with feeling so much discontent;sadness
9004;i was feeling very depressed everyday in the midst of having my dream life;sadness
9007;i feel bad about that but this last years i started to realize no matter how many friends i have or know it doesnt matter im still a loner;sadness
9008;i cannot help but feel that my life is a series of not so unpleasant accidents stumbling about trying to do the right thing;sadness
9009;i was feeling somewhat defeated and completely at a loss of what to do next;sadness
9021;i remember feeling awkward and strange during my first few weeks;sadness
9022;i found it really sad here are people feeling unhappy because the expectations they have about marriage and relationships are based on ideas that dont seem to connect with their real lives;sadness
9026;i feel hated betrayed paranoid childish and hurt;sadness
9029;i feel im ugly i feel that i dont deserve to exist in this world;sadness
9033;i feel after a horrible winter;sadness
9034;i cannot describe how happy i feel an emotional may sophat a year old patient from kandal said in the recovery room;sadness
9035;i am feeling a little homesick for colorado;sadness
9036;ive been feeling like im running on empty and fearful that ill get my usual progression of sinus infection to walking pneumonia so ive been pounding the a href http www;sadness
9044;i get up with max and feel so exhausted that i crawl back upstairs and find sleep for another hour or so but each week i try to make sure i workout days;sadness
9048;i am feeling melancholy sad depressed ok even angry that this is my second year without my oldest and youngest daughters klysta passed days ago andrea has chosen to not be with her family;sadness
9049;im feeling lonely while scott is at work;sadness
9050;i can use the data comparatively to determine whether i am feeling disappointed elated inspired et cetera;sadness
9052;ill admit that hes a pretty good designer but i feel like hes totally fake;sadness
9064;i feel my blood pound up my back and in my ears and i throw up it hurts point blank and period it hurts;sadness
9065;ive been feeling disheartened by the young adult genre after quite a few badly written novels but this one has restored my spirit and captured my heart;sadness
9072;i be able to look them in the face again without feeling awkward;sadness
9075;i always feel terrible afterwards and even more helpless which is yet another thing perpetuating my depression;sadness
9078;i moved into uni today and i feel so homesick and lonely and useless and part of mes saying fuck it go home and get a job and sod the degree;sadness
9080;i can also feel the pain along with the characters and in which i also feel devastated and depressive because of all the pain they have to suffer and endure;sadness
9088;i awoke an hour after feeling groggy;sadness
9089;i was made to feel like a pathetic piece of shit because i suffer from a mental illness multiple actually;sadness
9096;i cannot deny that right now i am feeling disillusioned with the avon;sadness
9100;this sounds really predictable and usual but it was absolutely heartrending at the time my first lover i was just rang up one day and announced that he had found another woman i never saw him again and it hurt because i was positive that it was true love;sadness
9101;i feel hopeless and in serious need of encouragement;sadness
9102;i feel disappointed impatient frustrated with myself as a guitar player;sadness
9117;i was trying to be a friend to him so that he wouldnt feel rejected by me;sadness
9120;i have a feeling they ll think it s dumb so i d rather just do this on my own for a while;sadness
9127;im feeling a little disillusioned about vision therapy lately;sadness
9129;i have been staying in the word and memorizing scripture and through this i feel that god is showing me just how ugly my heart is;sadness
9135;i hurt went on and found someone more worthwhile so why when i cast my mind back to those times does it still make me feel ashamed;sadness
9136;i feel ungrateful too;sadness
9141;i go further let me tell you why i feel unhappy;sadness
9142;im feeling kind of lonely right now even though i just talked to jack sarah and a lot of my other friends;sadness
9148;i feel like tna missed a trick not keeping the tag team of crimson and amazing red alive;sadness
9152;im personally happy grateful and embracing each moment but i feel that my patriotism is being abused;sadness
9156;i didn t expect reps to make me ache really especially as i often lift heavier for more reps but i have to say i can feel my muscles aching already;sadness
9163;i wanted to upgrade the characters i was creating and engage them in battles of a similar setting transformations the raising of energy flashy colors chaotic explosions feelings of desperation when the adversary has you beaten etc;sadness
9166;i feel very hopeless;sadness
9169;i made to take my mind of feeling soooo rotten;sadness
9173;i commented trying to keep my voice reasonably free from the feelings which gripped me i believe were beaten hendricks;sadness
9174;i just have a general feeling of this unpleasant heaviness from my stomach up;sadness
9176;i do feel a bit rotten;sadness
9178;im faced with the dreading feeling that no it wont work and all this will have been in vain;sadness
9180;i feel ashamed youre perfectly fine granting;sadness
9184;i feel i need to be punished;sadness
9186;i want to push myself to think more in terms of discipline and what is a pro goal and pro me choice and not immediately default to feeling deprived;sadness
9187;i feel like at times i am lauren for trying to help my friend see that her boyfriend is a lousy guy yes they might be best friends and never let that go but they re both not good for each other;sadness
9191;im not feeling so whiney about going alone to my conversion;sadness
9193;i feel absolutely guilty about this and crazy at the same time i am pregnant and i am suppose to get rounder;sadness
9195;i not now creative muse feels so low lack words to haiku for haiku heights prompt confession p;sadness
9198;i feel weepy a lot;sadness
9201;i stray i feel the pains of loneliness and discontent;sadness
9207;i hope the two of you don t feel it was all in vain;sadness
9211;i even got mad at god a little because i feel like im being punished;sadness
9213;im going to say is that i know my activities are out of balance when i start feeling burdened by something that is supposed to be fun;sadness
9214;i feel so ugly lately;sadness
9217;i remember feeling so lonely as a child in my room even though i had a lot of toys to keep me occupied;sadness
9219;i feel this place was tragic;sadness
9220;i don t feel rejected although i admit that i used to;sadness
9223;i spent the rest of the morning feeling discouraged and disappointed;sadness
9229;i know but it still feels very unpleasant;sadness
