;context;emotion
4193;i do have good days and bad days but the bad days are awful resulting in constant trips to the bathroom a lot of pain bloat and discomfort lots of blood and just feeling completely exhausted and rundown;sadness
4194;i feel so pained to see students on a school trip;sadness
4195;i feel defeated and low;sadness
4196;im so tired i feel weepy;sadness
4197;i duno i feel as if im doomed for ther rest of mi life;sadness
4200;i can spill my feelings to and tell every pathetic detail of my life;sadness
4202;i refuse to feel guilty;sadness
4203;i am feeling a little sorry for myself and worse for him;sadness
4204;i was an outsider and i never felt part as i was new that made me feel disheartened;sadness
4205;i lost a very dear friend in the maschke family who now wants nothing to do with me because they feel that i am unsavory or mean or cruel;sadness
4209;for the loss of a close friend or relative;sadness
4214;i seem to see the five years after the chinese pavilion which is the content of the exhibition on immigration but to see the plateau province in this country is treated as one country so i feel very unhappy and i think this is a national tourist attraction they point then why not prudent;sadness
4215;i feel horrible most of the time;sadness
4226;i feel as defeated as i did today i wonder if im doing this parenting thing all wrong;sadness
4227;i began to feel unimportant misunderstood the odd one out;sadness
4228;i feel listless and completely unmotivated to do anything but i will bake some almond poppy seed bread and make a pot of chicken noodle soup in an effort to be less than useless today;sadness
4237;ive been feeling so jaded;sadness
4242;i am feeling very inadequate about how to share my feelings and of how to write this blog post but i am going to give it a go and hope that it makes sense;sadness
4243;i already feel sleep deprived and short on time but if i really want to become a person that i can be proud of i need to start investing and stop paying the minimum amount on my credit card;sadness
4249;i feel resigned right now;sadness
4252;i feel like a bit of a turd that my body instantly rejected the lemonade;sadness
4257;i realised how sick i was of working and feeling and being alone;sadness
4259;i start to feel ugly unloved poor and unhappy;sadness
4261;i have always wanted ice cream when i feel lousy;sadness
4264;i can feel the strokes getting harder and faster as i try in vain to find that release;sadness
4272;i have no idea why am i feeling so aching when i am just thinking about it and the day have not come yet;sadness
4275;i feel like your child is worthless even though they passed the assessments better than anyone who applied with a college education;sadness
4279;i feel like i am doomed for the rest of my life;sadness
4282;i am made to feel useless;sadness
4285;i feel unhappy it is no help for me that other persons say that i am happy how much truth there may be in it;sadness
4286;i feel so numb that i wonder whether im still human;sadness
4292;i feel totally exhausted and over tired;sadness
4293;i want to stop feeling so worthless;sadness
4294;i hope that by telling them ill find out more about who i am how i got to this place in time and not feel so lost and alone;sadness
4296;im feeling a little bit melancholy tonight;sadness
4301;i feel so horrible that you had to go through all that just because you grew up a little earlier than your friends;sadness
4302;i feel so useless to her because the help i want to give her is the kind she doesnt believe in and doesnt want;sadness
4305;i feel in my heart and how much im hurt;sadness
4307;i would take days that i would feel low tuck them away and ignore it rather than sitting in it like i had learned to do in the past to get through these moments;sadness
4308;i hate struggling to enjoy life but at the same time i feel guilty when i do;sadness
4311;i was feeling beaten up by life yesterday you see i am in love with a schizofrenic man who i had to kick out of my house for having boisterous fights with himself;sadness
4316;i feel so unimportant which im probably am;sadness
4320;i quite like to do it standing on public transport or busy places when you often feel your space being invaded which can make you feel stressed;sadness
4325;i feel like im being punished if i have to sit facing the wall;sadness
4328;i am starting to feel a bit disheartened with my progress on my physical tbr there are still boxes of books next to my bed and they are not going away as fast as i want them to;sadness
4340;i woke up at around am or am the next day crunched at the bed because i was feeling a terrible headache so painful i was awaken from my sleep;sadness
4346;i feel so regretful not going but;sadness
4351;i walked away from them feeling discouraged about how technology seems to have replaced relationships in so many ways lately and what did i do;sadness
4355;i mean think about how that would feel that would be stupid embarrassing;sadness
4358;ive definitely been feeling low this past week because ive been sick ever since bfd but im determined to get my health back;sadness
4361;i walked away feeling a little dismayed but ive got a mission to carry out now;sadness
4364;im feeling more stressed;sadness
4369;i feel sorry for the rest of us in second life who understand that without more support for first time users our world will continue on its slow death spiral;sadness
4371;i really think each and every person can begin to sympathise with bernards character on which ever level this might be just because its part of being human to experience self doubt and feel worthless and ultimately unnecessary without purpose;sadness
4373;i feel like i am in ludicrous speed;sadness
4375;i forgot to feel sentimental about my line being pulled;sadness
4382;i feel left alone;sadness
4384;i feel lonely i remember my moms saying;sadness
4387;i do feel a little needy;sadness
4395;i feel lonely so unbearably crushingly lonely you are not the only one a href http creativeliar;sadness
4399;i shall have to stay feeling neglectful of all things art related;sadness
4400;i also find that during those times when i feel victimized by his loss i dont feel him near me at all;sadness
4401;i feel like everything i do i will make a mistake and i will be punished;sadness
4409;i woke up this morning feeling like the unfortunate drain cover that a href http www;sadness
4413;i should feel awful about the nonexistence of gods;sadness
4415;i miss them like crazy every time i think about them i feel a sense of melancholy a fervent yearning to see them to be by their side to know how they are doing;sadness
4419;i feel like ive been kinda listless;sadness
4422;i feel lethargic and do not really look forward to anything or take joy in anything and i kinda felt like that last night;sadness
4424;i think about it with the anticipation i was feeling yesterday its kind of a miracle that i didnt like fake an injury or something just to be able to go to the hospital to see them;sadness
4427;i feel very deprived i feel like i did so many things right amp so many things just went wrong;sadness
4428;i also feel useless and unfulfilled;sadness
4432;i have to admit that while the story itself was interesting in their portrayal of the well known biblical story i came away feeling a little disappointed with the end result especially considering the names involved;sadness
4434;i reflect back on all the beer i drank i feel shamed;sadness
4435;i am not feeling shitty about life anymore;sadness
4436;i feel when ever i listen to the msm main stream media deprived;sadness
4438;i sent her was pretty long and now i feel a little embarrassed looking back at the letter i gave her;sadness
4442;i know that i shouldnt have run around with his dirty socks on a stick like a flag for our friends to see no matter how angry or hurt i was feeling about the dirty laundry that he left me;sadness
4443;i feel shitty because she quit a job to come here but there is only so much hand holding and training that i am willing to do;sadness
4446;i feel like a divorcee we were together so long and our separation was so messy;sadness
4449;i personally feel they are doomed to finish dead last in the nl central without this key cog to any championship team;sadness
4452;i have been a procrastinator i have endless potential and passion inside yet im stuck in the cage of my own soul the unresolved feelings hurt resentment that i hold inside has built up even do i try to build myself back up again;sadness
4457;i really only get inspired to write on this blog when im feeling shitty about life and i guess september being my birth month and all was pretty great;sadness
4465;i hate feeling dumb i hate people who make me feel dumb or like i am being a baby;sadness
4466;i know that i should feel some sort of melancholy but i don t;sadness
4472;i worry theyll feel rejected or take my chosen plans as an insult;sadness
4478;i often feel disillusioned but i look upon it as a test of will and a test of character;sadness
4481;i flipped out at guys i feel terrible today i flipped out at guys i feel terrible a href http www;sadness
4485;i have hurt so much and been told to stop so much that i suppose it all leaked into my brain and now i feel guilty when i hurt;sadness
4487;i sit around and i feel disillusioned with school;sadness
4499;i feel i am wrongly punished or that my misbehavior was unavoidable i am allowed to argue over whether or not i should be punished or how severely;sadness
4505;im tired of feeling so lethargic;sadness
4506;i think you would all agree that feeling your toes and fingers go numb is perhaps one of the most unpleasant feelings ever;sadness
4507;i really feel disturbed over all this mayhem as i have been to this heavenly vale twice and personally know all the ground realities;sadness
4508;i feel like a lame bum bum in the sense of a behind not in the sense of a transient because i haven t been keeping up with others blogs;sadness
4510;i still go out sometimes but when i do i come home and cry i can feel how people look at me they know i am worthless too;sadness
4512;i do know is that even though its hard and sometimes we feel inadequate drained and like we cant go any further and just need a break even for a week or two;sadness
4514;i is celebrated with great fan fare which happens to be january th or october nd disregarding here of course the rare sense of gandhigiri euphoria generated by an unexpected source such as munnabhai we come across the inescapable phrase which i feel has been much abused a hindu fanatic;sadness
4519;i don t always have access to when i m feeling stressed which is usually the time i am most in need of the silence;sadness
4520;ive heard a lot of folks share frustrations with feeling inadequate after seeing so many pictures of perfection in projects and homes through blogs and pinterest etc;sadness
4524;i feel embarrassed but i don t want others to take pity on me i have too much pride;sadness
4529;i feel like im doomed to forever be the girl that everyone sleeps with but that no one can love;sadness
4534;i never want her to feel the pain of struggle of suffering;sadness
4536;im not sure if anyone else is like this but especially when im feeling low i dont particularly want to wear vintage clothing;sadness
4540;i lost my power feeling lethargic headachie tired mentally blah you get the picture;sadness
4542;i feel slightly embarrassed that i keep telling myself and trying to make myself believe that life is actually to enjoy just to be let down harder and harder each time;sadness
4546;i feel listless but today was aiiiiighhhht;sadness
4547;i leave in four weeks and im starting to feel a little heartbroken at the thought of it;sadness
4548;i feel so idiotic because of you;sadness
4559;i feel dirty for loving comments;sadness
4563;i feel these people are utterly useless in my view;sadness
4566;i was coming out of a lengthy illness and i was feeling lousy groundless indecisive and without any direction;sadness
4567;i feel gloomy or get really bad cabin fever;sadness
4569;i wish i didnt do butttt semuanya sudah terlambat dan i feel so stupid everytime i think about it and i think about it every time means i feel stupid everytime;sadness
4570;i didnt feel so stupid then but a still little bit ignorant compared with the native african healers who have been using this for over a century;sadness
4572;i am feeling a little lost without it;sadness
4573;i still feel ashamed at how i treated him;sadness
4575;when my elders do not understand me in the right way;sadness
4582;i still feel like i missed out on a critical part of the soap and for a;sadness
4586;i feel that this reality is tragic;sadness
4590;i havent really talked to anyone about it in depth because i feel like im being whiney repetetive and needy;sadness
4592;i am feeling foolish for taking lb to the e;sadness
4593;i am feeling a blank space in right testicle area and i think that right testicle size is being decrease through urinate system or the semen s out;sadness
4595;i want change but i feel like im discouraged because im living so comfortably;sadness
4603;i oil rich in omega reverses the look and feel of damaged hair as it weightlessly restores bounce for full flowing styles;sadness
4608;i feel at times life losses its joy and becomes empty and feelings of exhaustion over take our positive side;sadness
4609;im also worried that youre feeling a little lost in the middle these days and like youre not getting enough attention from us;sadness
4613;i feel a bit embarrassed at times when i make mistakes;sadness
4614;i have spent today feeling horribly unhappy;sadness
4616;i convince myself to write i feel like im just exposing how lousy i am at what im trying to do;sadness
4617;i come whenever i feel alone;sadness
4619;i will still feel homesick yes;sadness
4620;i just sat there feeling so empty and lost and scared;sadness
4622;i feel incredibly disillusioned with the weekend;sadness
4623;i know not all women feel this way but i have felt very unimportant int the church and almost dare i say second class citizen im not trying to bash the church but i think some women are so thirsty for knowlege about her to reinforce their own place and importance in the world;sadness
4625;im just not fully feeling it on an emotional level;sadness
4627;i invest in my friendships i feel hurt when i perceive that this investment is not returned;sadness
4632;i still have a lot to paint on the warhound but enough of the model is now put together that i would not feel embarrassed fieldi;sadness
4634;i was admiring and envying the figures of the twentysomething set ahead of me in class and feeling ugly jealous;sadness
4639;im not feeling deprived at all although i do wake up ravenous in the morning;sadness
4641;i feel foolish for thinking this would work;sadness
4649;i feel like i m worthless and i can t do any good for anyone even tought i try and try very hard;sadness
4651;i feel a little jaded after the banking crisis but i will vote labour and hope for the best;sadness
4653;i feel the most discouraged lonely and stressed;sadness
4658;i am feeling really sad;sadness
4662;i try to hang out with the both of them then i feel like this awkward third wheel;sadness
4663;i used to feel devastated when someone criticized what i did;sadness
4665;i cannot seem to shake this feeling of being completely numb;sadness
4669;i almost feel damaged some how;sadness
4673;i don t like being at home it feels so unwelcome in fact i despise it;sadness
4674;i am moving on and i feel sorry for you because i thought you were the most amazing boy ever;sadness
4675;i was telling her about how i was feeling a bit homesick;sadness
4678;i feel like i am being punished for going to school;sadness
4679;im feeling shades of foolish;sadness
4683;i feel so deprived since i know nothing about the first battle of bedriacum;sadness
4686;i was feeling a bit lonely because poor henrietta had been in the shop for so long and ariel was right in chelmsford waiting for me;sadness
4688;i feel so numb like this life i have been living for the past week has been unreal;sadness
4689;i feel listless i cant do anything of it;sadness
4690;i kept having this strong feeling of moving into something i stayed and i was punished for not stepping out when i should;sadness
4691;i am a bit depressed really feeling defeated;sadness
4693;i stopped writing because people stopped noticing me i was feel like i was ignored so why to write but now i feel i write for myself not for people why should i want be noticeable;sadness
4698;i started to sprint even when i consciously thought about my foot not even once did it register to my brain that i was feeling hurt from it;sadness
4705;i feel kind of lame this time around;sadness
4707;i feel bad the photo does not do it justice;sadness
4709;ive never thought i would feel so guilty for trying to protect someones feelings;sadness
4714;im destashing a couple cuts of fabric that id bought to make clothing and it has just sat around feeling unloved;sadness
4715;i was feeling very crappy and it was going down hill the entire week;sadness
4727;ive been meeting up many people since this semester but tonight at cinderalla i couldnt help but feeling sorrowful and down;sadness
4733;i feel most of your parents are republicans i shall not overload the stories with feeling or the need for society to be blamed for the outcome;sadness
4735;i am feeling all melancholy;sadness
4736;when my father passed away in i was left alone with my mother who was very sick so i had to go and live with my aunt;sadness
4740;i always feel this way in these moods but it s still unpleasant;sadness
4745;i feel like people dont really want me in their company but also they dont want to hurt my feelings;sadness
4747;i believed it was true love and feel devastated i wanted to settle down and have the whole marriage and kids thing with him;sadness
4752;i feel burdened both figuratively and literally;sadness
4763;i am that woman who will notice and i will send one your way even on days when i feel discouraged myself;sadness
4765;i was feeling drained before i even sat in the chair;sadness
4768;i feel pathetic to report that i know about as much korean after these three months as i did italian after a three week vacation in italy;sadness
4769;i feel like i m damaged goods and that he deserves better than this;sadness
4770;i can feel rejected just because someone needs to sleep;sadness
4777;ive finished it i feel foolish for having put any expectations on the story when i began reading it;sadness
4779;i felt humiliated and belittled me because it keyed into all of my trigger points it made me feel stupid and inarticulate and laughable and flattened about something i m passionate about knowledgeable about and see as my place in the world;sadness
4781;i feel lethargic and sluggish and i absolutely notice that at night its harder to fall asleep;sadness
4782;i literally just text tychelle to see if she wants to hang out because reading what i just wrote about my nonexistent social life made me feel so pathetic;sadness
4783;im feeling a bit dull today but a href http thepage;sadness
4784;i feel like i m always beaten up by some sort of evil people;sadness
4787;i mention that i feel ignored and sad on my crappy birthdays he reminds me that he threw a th birthday party for me;sadness
4791;i am convinced that being encouraged to be obedient to the commandments of god when done with compassion and love by caring church family members do not leave us feeling abused trapped and hopeless but strengthened hopeful and cherished by both god and his church;sadness
4792;i wasn t motivated i was tired and my guilt was making me feel worthless;sadness
4796;i had just begun to feel like teaching was my metier but am now resigned to the fact that i likely wont teach at university ever again;sadness
4801;im totally digging and all the band business over the last little while i feel like ive been totally socially and emotionally neglectful of a lot of shit in my world;sadness
4812;ive borne witness to the suffering of other innocent children at the hands of the violent and i feel helpless in trying to make things better for them;sadness
4818;i do feel drained and totally exhausted today;sadness
4823;i think im just feeling sentimental right now p aaaaand tis another work day tomorrow;sadness
4841;i have been going around feeling like i have roundly abused my poor tongue so ravaged by hops has it become i think it is a challenge to think of taste as a really physical sensation;sadness
4847;i know how you feel and im sorry;sadness
4851;i can feel is horrible that for someone somewhere theyve felt that bad and worse;sadness
4859;im clocking in the scale in the s and i feel terrible;sadness
4861;i feel even more empty;sadness
4862;i also feel ungrateful after hearing stories from my grandma about people she knew at hospitals or nursing homes who had no one to talk to at all and for whom simple small talk was a huge step;sadness
4864;i am not even attempting to plan to be perfect that week it wont happen so i need to make a plan to atleast get through it without feeling deprived or mad at myself;sadness
4868;im feeling sorry for myself i think of miss jimmy who had nothing and yet was thankful for everything;sadness
4871;i feel like a regretful soul;sadness
4872;i feel resigned to my lot in life being that i watch everyone else become a parent;sadness
4882;i feel like the apothecary in romeo and juliet an unfortunate comparison perhaps;sadness
4886;i do feel a bit deprived of a typical experience;sadness
4889;i wonder how this feeling of being sentimental can help me through the agony of writing a report which dues tomorrow;sadness
4891;i feel so sorry for the people affected;sadness
4892;i didnt feel any real emotional connection this not being so much a character driven story;sadness
4893;i feel like a guilty sack of shit;sadness
4894;i cant begin to think of how that would feel morose doesnt even begin to cover it;sadness
4895;i had a sudden feeling of missed opportunity here i could have asked how their evening was going;sadness
4897;i shouldnt feel gloomy;sadness
4901;ive fallen asleep embracing a person but never a book and we both woke up this morning feeling kind of awkward about it;sadness
4907;i feel so dumb for being honest;sadness
4909;i don t want to feel anything i want to be numb;sadness
4913;i really feel stupid;sadness
4914;i must say it is a wonderful feeling and makes me feel so submissive;sadness
4915;i find myself feeling sentimental pretty much every day;sadness
4917;i feel so sorry for californians;sadness
4918;i felt good in a way where i really didn t feel the tension of being punished for a day;sadness
4925;ill write again soon cant wait to hear from everyone im feeling pretty homesick right now;sadness
4933;i can feel the damage in aching joints headaches backaches etc;sadness
4934;i always feel so unimportant so much that i always wonder if people remember my birthday;sadness
4935;i used to have this friend who always always had to have a boyfriend and if she didnt she would get majorly depressed and feel defective or something and i think she was that way because of her mom and i always felt really bad for her;sadness
4946;i must bring some perspective into the equation consider how you would feel if you went a week without calling and then phoned up to find out youd missed your final opportunity to talk with a parent;sadness
4947;i find myself chasing the needles and feeling stressed during the entire process;sadness
4948;i feel bad that i don t have anything for you;sadness
4949;i feel like a jaded cat whatever who doesn t ever get nervous before races because i ve just done so many and i couldn t care less;sadness
4951;i said eventually it brings me down again not only because of the sugar that it contains which as i said ends up making me feel groggy and gives me a tummy ache but also because of the guilt i feel afterwards;sadness
4952;i feel beaten by it;sadness
4956;i feel utterly dismayed that our favourite lloyd grossman product has been ditched;sadness
4957;i am bogged down by the feelings of being unloved it only ends up making me feel worthy of love that is being showered upon me how can i feel the love and joy if i feel deep within me unworthy;sadness
4959;i feel louis vuitton took it up to the court and now on for instance ebay you cannot buy fake lv anymore well not on purpose that is;sadness
4963;ive tried and tried and every single person i hang out with i just feel like everything about it is fake;sadness
4964;im stuck feeling hopeless at this time;sadness
4966;i feel horrible about wanting sonipro amp source geekparty linkedin a target blank title share on tumblr rel nofollow href http www;sadness
4969;i tell my a little how much i hate feeling needy how i hate that moment when i know ive become too attached in my own head;sadness
4970;i feel like ive hated on this series a lot since ive started blogging so a little honesty is in order;sadness
4976;i am left feeling numb and shaky;sadness
4977;i could continue feeling awful and crying to all my friends and focus on how wronged i had been and end up feeling worse;sadness
4982;i feel humiliated i choose to believe that somehow janis sanders will see these words and know that he cannot get away with abusing others;sadness
4983;i feel as if i am completely worthless;sadness
4984;i feel remorseful but i am not ready to die and i do not look in the mirror;sadness
4985;i definetly need both as i have been feeling quite lethargic;sadness
4990;i don t fit in and never will despite the fact if you gave me the option i would still choose to be an outsider and combined with the lack of creativity and originality and dare i say it the utter conformity of the student body it just makes me feel depressed;sadness
4991;i feel unpleasant time is long;sadness
