;context;emotion
0;i didnt feel humiliated;sadness
1;i can go from feeling so hopeless to so damned hopeful just from being around someone who cares and is awake;sadness
5;ive been feeling a little burdened lately wasnt sure why that was;sadness
10;i feel like i have to make the suffering i m seeing mean something;sadness
13;i feel low energy i m just thirsty;sadness
16;i didnt really feel that embarrassed;sadness
17;i feel pretty pathetic most of the time;sadness
18;i started feeling sentimental about dolls i had as a child and so began a collection of vintage barbie dolls from the sixties;sadness
25;i still love my so and wish the best for him i can no longer tolerate the effect that bm has on our lives and the fact that is has turned my so into a bitter angry person who is not always particularly kind to the people around him when he is feeling stressed;sadness
26;i feel so inhibited in someone elses kitchen like im painting on someone elses picture;sadness
27;i become overwhelmed and feel defeated;sadness
44;i was feeling so discouraged we are already robbing peter to pay paul to get our cow this year but we cant afford to not get the cow this way;sadness
45;i was feeling listless from the need of new things something different;sadness
51;i found myself feeling a little discouraged that morning;sadness
55;i feel you know basically like a fake in the realm of science fiction;sadness
56;i hate living under my dads roof because it gives him an excuse to be an asshole to me because hes providing for me to live here i think he feels that he needs to make me feel as unwelcome as possible so ill leave;sadness
67;i have been on a roller coaster of emotions over these supposed feelings that something unpleasant was coming;sadness
70;i am feeling miserable but c i am also the proudest mum on earth;sadness
71;i figure my family loves us no matter what but around anyone else i feel embarrassed when michelle goes ballistic;sadness
73;i can feel my ovaries aching talking to me as i like to put it;sadness
74;i didn t feel like doing much chris and i mostly just took too many pictures of unimportant stuff;sadness
75;im tired of the book and ready to have it out of here and finding out that i was given unsuitable images and then feeling blamed for the result did not sit well;sadness
80;i feel like a miserable piece of garbage;sadness
88;i feel so worthless during those times i was struggling finding work;sadness
92;when my mums brother passed away after having been involved in a car accident he was bringing me a present as i had passed my form five exams with flying colours;sadness
95;i feel like throwing away the shitty piece of shit paper;sadness
98;i hear are owners who feel victimized by their associations the associations attorneys or the property manager;sadness
104;i mean really really hard works to obtain such a high technical skill in wushu feel kinda ashamed but somehow motivated when i saw kids doing wushu performances whole heartedly despite their tiredness;sadness
109;i did alright in class but a combination of feeling unsuccessful being man handled the stress of late and my horrible week resulted in my almost crying after i finished grappling;sadness
113;i feel ugly i m more inclined to wear ratty jeans and a sweatshirt than a beautiful dress though i might still wear a pair of heels around my house to boost my self esteem ever so slightly but i definitely won t bother to buy a new pair;sadness
114;im not feeling homesick yet so im feeling alright about this;sadness
117;i feel all of this just from her eyes not from her touch or from her words but from her eyes i know that i can assuredly return this love and know that it shall not be in vain;sadness
123;i get into groups i feel really awkward and overcompensate by being too talkative or by getting really quiet;sadness
140;i do not feel miserable at all because my family is not the type that celebrates eid;sadness
142;i still feel sleep deprived she is almost sleeping through the night giving us;sadness
146;i feel a need to protect my parents against the witch hunt that repressed memory therapy can be;sadness
149;i couldn t know what he was feeling then i thought that he wished he could have been there with us too for each of us knew that however much we hated it at first it was an experience we would remember forever;sadness
155;i could feel her whimper to the thought of being unloved and uncared for;sadness
162;i am fatter because the only thing in my life that can remain under my control is whether or not i get to eat peanut butter on bread when i get home from an impossible day of to first world looking yet third world feeling hell of needy and neglected little girls;sadness
164;i feel so sad and hopeless;sadness
166;i still feel groggy but i have to get up to do the routine for my son;sadness
177;i just wish okay so i was thinking about it earlier today and heres the thing being all cooped up amp restless has made me feel so needy;sadness
180;i am no fan of the current president i am a conservative and it made me feel unwelcome;sadness
185;i feel like i m always the one getting punished for stupid things and i feel like i m being chastised for behaving;sadness
194;i felt sad when a friend of mine died and i felt that something had irrevocably gone away from me;sadness
195;i died would alex and matt feel regretful for not coming to visit;sadness
198;i feel like these are very boring sewing makes since they are so easy and there is nothing else to say about them than my fabric usage;sadness
206;i legs would feel shitty for a few miles but would come around like they always do;sadness
209;i feel abused and maligned but mostly tired of the nervous feeling anticipating danger;sadness
212;i have to admit these hilarious e cards are seriously exactly how i feel i am so stressed out i feel at any moment i could start hy;sadness
213;i wrote last year when i was feeling more dull and inarticulate than normal;sadness
218;i will spend my vacation on me no obligations no headaches no feeling like i am being emotional blackmailed into being three places at once;sadness
222;i am feeling disheartened with my words as of late;sadness
229;i continue to define and discover what home can mean here in amsterdam whenever i feel a pang of blank sickness it is more in line with missing the cultural mindset of american city life which is much different from the cultural mindset of amsterdam;sadness
233;i go online and i see a friend talking to another one and is not talking to me i feel ignored i feel unloved;sadness
240;i feel stressed always;sadness
241;i remember feeling another cramp but i also ignored it;sadness
243;i have also learned it takes a lot of effort and positive thinking for me not to break down in tears over feeling exhausted and guilty for not being a better mom;sadness
244;im feeling awful because we hung out with my friend and her new baby the day before;sadness
246;i feel the suffering and i really feel the pain;sadness
251;i feel totally listless exams have come and gone and now i have a whole five or so months in front of me with no uni and free time;sadness
253;i feel as if i was abused in some way;sadness
258;i can feel myself gaining control over the damaged goods aspects of my personal security;sadness
262;i feel victimized by the drag on our country with heads in the sand traditionalists i hesitate to call them conservatives for fear of offending real honest to god conservatives who still think the world was created years ago and that stuff like skeletal remains are some kind of hoax;sadness
264;i have been for my bloods which proved the reason i was feeling so lethargic and rubbish was that i am low on iron so i have now been prescribed iron tablets;sadness
267;i feel as if i should be punished for neglecting you;sadness
269;i feel like i ve lost some of my main roots i feel less secure emotionally financially and socially;sadness
270;i feel like i should just bite the bullet and do it but every time i think about it i feel stressed because im not fully supported on my decisions;sadness
271;i know i have some obnoxiously immature sounding verbal tics and my voice is kind of nasal and i don t always come across like the sharpest tool in the shed especially when i m feeling awkward but there s knowing and there s knowing you know;sadness
272;id just had a terrible nightmare and was feeling a little disturbed;sadness
273;i didnt want to walk passed there just in case the customers feel disturbed;sadness
274;i want other sufferers to be able to find me in the hope that my battle can help them to feel that they are not alone;sadness
277;i am not looking forward to being beaten down to feeling like a disappointment to my husband or to the emotional pain;sadness
278;im sick of feeling crappy;sadness
281;i feel a perverse pride in my self control that i managed to stay where i was ordered and not reach for the tempting human flesh so close before us;sadness
283;i was positively giddy when the kids left this morning after our very last official class of the year but now im feeling a little sad;sadness
288;i personalities that can feel pain and suffering;sadness
290;i was warming up starting feeling a little lethargic;sadness
294;im just feeling rather sentimental right now and just have to say i feel so lucky to be maxs mom;sadness
295;i make myself show up and feel isolated in the crowd ill know i was wrong about the anti social feeling;sadness
296;ive learned how to turn off all my emotions more and more and i often find myself feeling completely blank while my mother is crying continuously over my suicidalness;sadness
299;i can finally stop feeling listless and like a waste of space;sadness
308;i feel really ashamed;sadness
312;i have many days where i feel hopeless today the light at the end of my yellow brick road was shining just a little brighter;sadness
313;i actually feel sorrowful;sadness
317;i began to feel each of my senses dull until the cold black unconsciousness over came me;sadness
322;i feel empty when the baby isnt there;sadness
323;i stopped feeling so exhausted a href http provokingbeauty;sadness
327;i be made to feel rotten;sadness
346;i feel like im just on the edge in this microcosm one more awkward moment or missed party and id be on the outside;sadness
350;i feel burdened to share it;sadness
362;i thought we were going to talk and try and work at things so i was shocked to find out steve had decided he wanted to be on his own the thing that broke me was the feeling of been unloved;sadness
363;i wouldnt have beared witness to the incredibly well spoken bouncer making an emo kid feel completely unwelcome;sadness
364;i tend to stop breathing when i m feeling stressed;sadness
370;i crave as i fall into submission and i did not feel submissive in the least;sadness
373;i made it to work but i am feeling a little groggy;sadness
377;im starting to feel unwelcome in life and some people can already tell this;sadness
385;i just busy myself with other stuffs but never with blogs or threads that will only make me feel miserable;sadness
389;i close my eyes i can hear the pitiful wailing sounds of my own cries taste the salty taste of my tears and feel that anger and hurt saturating my heart;sadness
399;i am feeling pretty worthless right now;sadness
401;i had continued to think along those lines i probably would have done the dishes in anger and when he got up wed have had a fight about that with me feeling completely abused;sadness
404;i was feeling like a pretty crappy mom;sadness
410;im then left feeling quite embarrassed as i say that nothings new;sadness
411;i feel unwelcome and out of place buti cant decide if i am just too scared to do anything about this ok situation or if i am staying here in this dead end situation because i am afraid things will get worse;sadness
415;i feel burdened for several loved ones and i miss my big kid whom i havent seen since friday;sadness
416;i feel is still really low in my abdomen;sadness
424;i try to get in at least minutes a day five days a week though i have been known to skip a workout if i m feeling particularly lethargic or lazy;sadness
425;i have been feeling beaten down sick and utterly devoid of hope that i will ever have the life i want;sadness
429;i find myself having much more time to think about myself without feeling depressed to actually be able to write and imagine without feeling trapped or like i am missing out on something a near constant feeling i have in cities;sadness
431;i feel like ive had to fake my feelings a lot more often then i would have liked to;sadness
433;im really like she said only you can understand the way i feel toni ight she blamed excesses on the merican dream so seldom witnessed never er seen hah hah hah hah hah;sadness
435;i dont know where i want to work because there will always be something that makes me feel stressed or anxious at work whatever the job may be as all jobs require some sort of rules or pressure;sadness
439;i wonder how many people are against my do it only when you feel like it perspective but i think if you do it for the sake of doing it without wanting to do it then it will turn out to be the result of crappy work;sadness
441;i should have known she likes kamiki kun he laughs nozomi feels an unpleasant knot in her stomach you must think i m a fool don t you nonchan;sadness
442;i made the choice to start recognizing when that feeling of being unloved kicks in and to choose to keep my persistence at the same level not allowing that old reaction to shut me down;sadness
453;ive become anxious about in recent times is this there is certainly a feeling amongst some people of belief that they are under siege that they are often disadvantaged that they are looked at and considered in some way different and their faith makes them less worthy of regard he said;sadness
455;i hate chemo and the thought of having toxins washing through every single cell and making me feel horrible makes me cringe;sadness
464;i always feel like ive been assaulted by his pics;sadness
466;i feel incredibly isolated and lonely;sadness
469;i was i admit very worried about feeling isolated i work in a cubicle pretty much on my own unless someone needs me;sadness
476;i make light of it but sometimes i feel really awkward in small groups and in one on one conversations;sadness
478;i also feel like if google hated seo we d know it;sadness
483;i feel like she s judging me and he s not here and i don t want to seem like the needy girl so i don t know;sadness
485;i feel burdened by her presence;sadness
491;i feel really pathetic confronted with some;sadness
494;i am feeling terribly burdened by impending anxiety i am trying to just keep my eyes on the prize;sadness
495;i feel could be unpleasant is layered with love healing forgiveness and the expectation that things will turn out well;sadness
496;im feeling gloomy as i have completed nothing though im supposed to complete many things;sadness
500;i love children s literature authors who don t feel the need to dumb down things for kids;sadness
501;i was soo quiet it was a mixture of not sleeping well and feeling a bit isolated from the big group;sadness
505;i feel like today is way suffering than the exam day which we have to open books everytime we went home;sadness
509;i feel miserable on the inside but on the outside i just like i;sadness
527;i feel i was unfortunate with both mister magnum and sounds of cheers travelling well for long periods of the race;sadness
530;i feel drained of energy;sadness
532;i am feeling pretty stinkin shitty for being such a horrible reviewer;sadness
533;i feel helpless about it;sadness
534;i was feeling awful on sunday;sadness
537;ive been studying really hard for it and discovering pretty words that never crossed my mind and how they portray the exact meaning and i feel like ive missed out a lot;sadness
538;i feel lonely at work im not a social bird as i usually am when i was in school;sadness
542;i think this may be the reason i would want to fly back to uae because there i can be oblivious of these conflicts that plague me conflicts that i feel helpless resolving;sadness
543;i saw the video of cena kissing maria and surprisingly i didnt feel like i hated her;sadness
545;i was not feeling submissive;sadness
551;i sat on my couch for several hours feeling pretty low;sadness
561;i can feel but i cant touch you said my love was a bit too much i wont deny it broke my heart cant find no crush so why dont you come on back home;sadness
563;i even remember trying them on last year and feeling crappy because i was nowhere near closing them;sadness
569;i did at one point put my son in daycare but my mom constantly made me feel like a terrible parent because of it;sadness
574;ive had too much training in grammar and language and reading something written like this kind of feels like im being assaulted;sadness
579;i know scones are not a must have food but i am determined to live a frugal lifestyle without feeling deprived;sadness
581;i feel that horrible helplessness to make things better for them and that feels like it will kill me inside;sadness
582;i have a few more of these but after taking pictures of my house i feel it is far too messy to post photos online so ill clean up a bit before i post those;sadness
583;i feel hated loathed;sadness
585;ive been feeling very numb;sadness
589;i feel that is very unfortunate that i dont own the soundtrack;sadness
594;i feel lonely and lost;sadness
595;i would feel empty;sadness
600;i love some of it the media coverage but sometime i feel they put an ugly picture;sadness
601;i feel as though i am being a little neglectful of my fellow bloggers;sadness
605;im feeling quite lonely here now and its only monday of half term;sadness
606;i feel really socially awkward and dont like to get out and meet new people and do things in groups and be adventurous;sadness
608;i feel horrible because i feel horrible made worse by the fact that i havent gotten to workout;sadness
610;i feel it and im unhappy;sadness
618;i quickly trotted off he added i feel embarrassed to ask hoping i would enter into some kind of conversation with him;sadness
619;i hated that when i got drunk the whole next day was spent sleeping and feeling groggy;sadness
630;i feel is that i cant get far enough away from what feeds melancholy for long enough that it would just wither and die off;sadness
642;i was left feeling discouraged and hopeless once again;sadness
643;i feel that this is going to get very messy to get fixed and back on the road again;sadness
650;i feel quite strongly that students should be punished due to how well or badly they have faired compared to a completely unrelated group of people;sadness
655;i feel at least dating them would not be in vain;sadness
657;i do not feel unhappy miserable wretched glum gloomy forelorn or heartbroken;sadness
669;i knew where things was headed but that didnt really prepare me for the heartbreak even i would feel my heart broke for danielle and all other military wives that have had to go thru losing their husband trying to protect our country;sadness
677;i feel lonely few days before my birthday;sadness
681;i was feeling so low about myself;sadness
683;i feel sorry for rafael bosch;sadness
684;i hope for is that those certain people can attend to more important things in their lives but still come back to blogging if they feel they missed blogging;sadness
687;i begin to feel unpleasant about anime fandom in general;sadness
690;i am feeling miserable and sick but hoping that with the amount of sleep i am getting i havent had much choice i have had zero energy cold meds vitamins and lots of fluids i have high hopes to feel better tomorrow;sadness
693;i feel troubled because of the ongoing relocation of our front door;sadness
707;i feel heartbroken for bryan;sadness
708;i feel like i had fake everything;sadness
720;im an introvert by which i mean i get re energized being alone and preferably in a quiet place so times in the crew galley when there are a lot of people in a relatively small place all talking at once can leave me feeling drained and in need of a dark room with nothing but whale noises;sadness
724;i feel numb right now i thought i was feeling angry but now i dont know i dont feel anything should i be sad should i be happy or angry i dont know how to feel anymore;sadness
725;i just feel so discontent about my life these days;sadness
730;i have always had people in my life who have gone out of their way to put me down trip me up or make me feel as if i were completely moronic or not worthy enough;sadness
732;i prep myself for another sleepless night i can t help but feel ashamed of myself for feeling this way;sadness
735;i wouldn t throw it in the ocean but i don t feel i would have missed something in my career if i don t win an oscar;sadness
737;im not used to feeling the dependency or the neediness for being needy is not me or at least wasnt prior to recently;sadness
745;i love this little boy and sometimes i feel how inadequate i am as a parent to him;sadness
746;i keep these things predominantly for fix functions and will not arranged right now to create a style applying twelve months previous ingredients until i m feeling much more perverse than usual;sadness
748;i feel sad and discouraged;sadness
762;i feel very unhappy and incomplete;sadness
765;i feel rejected and unwanted;sadness
768;im feeling lousy i may dismiss a gorgeous day if im feeling bright and cheerful then the most dreary of days becomes tolerable;sadness
779;i sometimes feel disheartened when i realise just how far from my own culture i am;sadness
782;i feel hopeless and out of control;sadness
783;i feel horrible that i had to cancel on one of my best guy friends but the trip was stressing me out because my babysitting hours got cut and i couldn t afford it;sadness
784;i climbed a mountain and made my way to a village where the people stared at me the children looked frightened and ran away and everyone i came across asked me why i was there in such a way as to make me feel unwelcome;sadness
785;i dont feel inhibited and i can work out my problems;sadness
787;i have done so in hopes of being inspiring while at the same time looking for solace from people rather than god and for proof that maybe i can do something good while i feel so horrible;sadness
788;im feeling melancholy with all the back to school stuff today;sadness
804;i begin to feel burdened by things amp long to be empty again;sadness
806;i feel so numb f;sadness
815;i am limiting myself to what i can reasonably do without causing greater injury but i have to do some sort of physical exercise or i start to feel horrible about myself;sadness
823;i started to feel discouraged at the thought of being there more than one day;sadness
825;im already feeling sentimental about his time as a newborn as he was so wee and has sadly outgrown some fave thrifted outfits;sadness
834;i feel if journalists then blamed me;sadness
838;i feel like im not pretty enough like my personality is too boring and obnoxious;sadness
841;i have switched songs as that one was beginning to make me feel a little melancholy and who the fuck needs that;sadness
842;i feel embarrassed to talk to him at times because i feel very small in those moments like he is doing me a favor and i do not deserve to be given attention;sadness
843;i sound so entitled but you cant help but to feel disappointed even though you already knew you were going to be;sadness
846;i was feeling remorseful about my breakfast and so i took a diet pill;sadness
847;i feel as though the concept of lifestyle change rather than weight loss has been beaten to death but it really is something that i believe in and am currently experiencing;sadness
848;i do not know what my next steps are but i no longer feel lost;sadness
849;i have been feeling awful;sadness
857;i was on my own tearful and feeling unloved even though i know that i am;sadness
860;i was starting to feel a little stressed;sadness
863;i feel ashamed to have not read it yet;sadness
864;i hear about a teenaged girl devastated by the pimple on her face the morning of prom i feel devastated for her;sadness
866;i feel unwelcome at work sometimes and think people might be talking about me rel bookmark i feel unwelcome at work sometimes and think people might be talking about me april a class url fn n href http www;sadness
890;i mostly take the stairs there are of them but occasionally when i am feeling particularly lethargic because of a number of consecutive late nights i bow down to ease and convenience;sadness
892;i feel sort of pathetic saying that my iphone internet and tv are my must haves but lets be honest they are;sadness
893;i guess while i can understand their concern i can t help but feel a little rejected;sadness
900;i feel my brain damaged are getting worst for dis moment;sadness
902;the funeral of a friend who was killed in a car accident she was of my own age;sadness
905;i out of all people really dont have many proplems talking about how i feel that being said i am in love so after all i have bitched about the last months was in vain;sadness
907;i cant imagine the agony those folks feel waiting for news about their own sentimental things;sadness
909;i feel all messy;sadness
910;i do this i feel lethargic uninspired and the next morning have a go at myself;sadness
916;i feel lethargic and lazy and completely uncomposed if i m not dressed in something like that;sadness
917;i feel that the director editor missed a teachable moment when tiphany makes her comments about it being nice to feel like everyone else;sadness
921;i have realized that by ignoring it i am no better and it is heartbreaking to feel so helpless against it;sadness
925;i feel so terribly that i have ignored her sweet email up until now;sadness
933;im feeling low and forgotten;sadness
